    1   0.000000 192.168.43.121 TCP 66 192.168.43.58 56695 → 21 [SYN] Seq=0 Win=8192 Len=0 MSS=1460 WS=1 SACK_PERM=1
    2   0.000071 192.168.43.58 TCP 66 192.168.43.121 21 → 56695 [SYN, ACK] Seq=0 Ack=1 Win=65535 Len=0 MSS=1460 WS=256 SACK_PERM=1
    3   0.005194 192.168.43.121 TCP 54 192.168.43.58 56695 → 21 [ACK] Seq=1 Ack=1 Win=8192 Len=0
    4   0.005690 192.168.43.58 FTP 115 192.168.43.121 Response: 220-FileZilla Server 0.9.60 beta
    5   0.042072 192.168.43.121 FTP 68 192.168.43.58 Request: OPTS UTF8 ON
    6   0.042226 192.168.43.58 FTP 118 192.168.43.121 Response: 202 UTF8 mode is always enabled. No need to send this command.
    7   0.088491 192.168.43.121 TCP 54 192.168.43.58 56695 → 21 [ACK] Seq=15 Ack=126 Win=8067 Len=0
    8  12.083347 192.168.43.121 FTP 66 192.168.43.58 Request: USER user1
    9  12.083756 192.168.43.58 FTP 87 192.168.43.121 Response: 331 Password required for user1
   10  12.146177 192.168.43.121 TCP 54 192.168.43.58 56695 → 21 [ACK] Seq=27 Ack=159 Win=8034 Len=0
   11  15.360100 192.168.43.121 FTP 68 192.168.43.58 Request: PASS hggghhh
   12  15.360547 192.168.43.58 FTP 88 192.168.43.121 Response: 530 Login or password incorrect!
   13  15.409248 192.168.43.121 TCP 54 192.168.43.58 56695 → 21 [ACK] Seq=41 Ack=193 Win=8000 Len=0
   14  37.273770 192.168.43.121 FTP 66 192.168.43.58 Request: USER user1
   15  37.274058 192.168.43.58 FTP 87 192.168.43.121 Response: 331 Password required for user1
   16  37.297245 192.168.43.121 FTP 68 192.168.43.58 Request: PASS ugtfvhh
   17  37.297455 192.168.43.58 FTP 113 192.168.43.121 Response: 421 Temporarily banned for too many failed login attempts
   18  37.297538 192.168.43.58 TCP 54 192.168.43.121 21 → 56695 [FIN, ACK] Seq=285 Ack=67 Win=65536 Len=0
   19  37.301647 192.168.43.121 TCP 54 192.168.43.58 56695 → 21 [ACK] Seq=67 Ack=286 Win=7908 Len=0
   20  37.332185 192.168.43.121 TCP 54 192.168.43.58 56695 → 21 [FIN, ACK] Seq=67 Ack=286 Win=7908 Len=0
   21  37.332220 192.168.43.58 TCP 54 192.168.43.121 21 → 56695 [ACK] Seq=286 Ack=68 Win=65536 Len=0
